{
	"persons": [
		{
			"id": 1,
			"code": "PAL",
			"firstname": "Ward",
			"lastname": "Palacio",
			"locationcode": null,
			"companycode": "MC",
			"rolecode": null,
			"contacts": [
				{
					"code": "CE",
					"value": "ward.palacio@mycompany.com"
				},
				{
					"code": "CM",
					"value": "+1-5855072888"
				},
				{
					"code": "CM",
					"value": "+1-5166472404"
				},
				{
					"code": "AD",
					"value": "7292 Dictum Av. San Antonio MI 47096"
				}
			]
		},
		{
			"id": 2,
			"code": "KRZ",
			"firstname": "Evelina",
			"lastname": "Kriz",
			"locationcode": "CDG",
			"companycode": "MC",
			"rolecode": "OFC",
			"contacts": [
				{
					"code": "CE",
					"value": "evelina.kriz@mycompany.com"
				},
				{
					"code": "CM",
					"value": "+33-0245291274"
				}
			]
		},
		{
			"id": 3,
			"code": "LUC",
			"firstname": "Roselia",
			"lastname": "Luca",
			"locationcode": "Office",
			"companycode": "MC",
			"rolecode": "CFO",
			"contacts": [
				{
					"code": "CE",
					"value": "roselia.luca@mycompany.com"
				},
				{
					"code": "CM",
					"value": "+39-2566716273"
				}
			]
		},
		{
			"id": 4,
			"code": "COB",
			"firstname": "Kenny",
			"lastname": "Coburn",
			"locationcode": "JFK",
			"companycode": "YC",
			"rolecode": "CEO",
			"contacts": [
				{
					"code": "CE",
					"value": "kenny.coburn@yourcompany.com"
				}
			]
		},
		{
			"id": 5,
			"code": "LUN",
			"firstname": "Magdalene",
			"lastname": "Lunde",
			"locationcode": "JFK",
			"companycode": "MC",
			"rolecode": "CTO",
			"contacts": [
				{
					"code": "CE",
					"value": "magdalene.lunde@mycompany.com"
				},
				{
					"code": "CM",
					"value": "+1-9149309763"
				}
			]
		},
		{
			"id": 6,
			"code": "FRE",
			"firstname": "Valerie",
			"lastname": "Frese De La Roche Por Lo Longo Name Longo De Longo",
			"locationcode": "CDG",
			"companycode": "MC",
			"rolecode": "OFC",
			"contacts": [
				{
					"code": "CE",
					"value": "valerie.frase.delarocheporlolongonamelongodelongo@mycompany.com"
				}
			]
		},
		{
			"id": 7,
			"code": "PIN",
			"firstname": "Michael",
			"lastname": "Pindru",
			"locationcode": null,
			"companycode": "MC",
			"rolecode": "OFC",
			"contacts": []
		}
	],
	"contacttypes": [
		{
			"code": "CE",
			"name": "Company Email",
			"color": null,
			"type": "email"
		},
		{
			"code": "CM",
			"name": "Company Mobile Phone",
			"color": null,
			"type": "phone"
		},
		{
			"code": "AD",
			"name": "Address",
			"color": null,
			"type": "address"
		}
	],
	"companytypes": [
		{
			"code": "MC",
			"name": "My Company",
			"color": "#c62828"
		},
		{
			"code": "YC",
			"name": "Your Company",
			"color": "#c6ff00"
		}
	],
	"roletypes": [
		{
			"code": "OFC",
			"name": "Office personnel",
			"color": "#c62828"
		},
		{
			"code": "CFO",
			"name": "Chief Financial Officer",
			"color": "#c6ff00"
		},
		{
			"code": "CTO",
			"name": "Chief Technology Officer",
			"color": "#c6ff00"
		},
		{
			"code": "CEO",
			"name": "Chief Executive Officer",
			"color": "#c6ff00"
		}
	],
	"locationtypes": [
		{
			"code": "JKF",
			"name": "John F. Kennedy International Airport",
			"color": "#547dbf"
		},
		{
			"code": "CDG",
			"name": "Charles de Gaulle Airport",
			"color": "#50b279"
		},
		{
			"code": "Office",
			"name": "Main office",
			"color": "#349619"
		}
	],
	"hash": "XWg1Trr9T2xVbYobSVgzBB=="
}